[
   {
      "id": 1021,
      "name": "Betreiber",
      "question": "Welches Verkehrsunternehmen betreibt die Fahrkartenverkaufsstelle?",
      "description": "Bei Verkaufsstellen handelt es sich um Einrichtungen, die Fahrkarten verkaufen (z.B. offizielle Vertriebsstellen der Verkehrsunternehmen oder des Verbundgebietes). Die Verkaufsstellen sind i.d.R. mit einem Erkennungszeichen (Tafel, Wimpel, Aufkleber, etc.) ausgestattet.",
      "input": {
         "type": "String",
         "values": {
            "single": {
               "name": "Betreiber",
               "osm_tags": {
                  "operator": "%s"
               }
            }
         }
      },
      "conditions": [
         {
            "osm_tags": {
               "shop": "ticket",
               "tickets:public_transport": "yes",
               "operator": false
            }
         }
      ]
   },
   {
      "id": 1022,
      "name": "Rollstuhlgerecht",
      "question": "Ist die Fahrkartenverkaufsstelle rollstuhlgerecht?",
      "description": "Rollstuhlgerecht bedeutet, die Fahrkartenverkaufsstelle ist stufenfrei erreichbar und die Zugänge haben eine ausreichende Breite (≥90cm).",
      "input": {
         "type": "Bool",
         "values": {
            "true": {
               "osm_tags": {
                  "wheelchair": "yes"
               }
            },
            "false": {
               "osm_tags": {
                  "wheelchair": "no"
               }
            }
         }
      },
      "conditions": [
         {
            "osm_tags": {
               "shop": "ticket",
               "tickets:public_transport": "yes",
               "wheelchair": false
            }
         }
      ]
   },
   {
      "id": 1031,
      "name": "Betreiber",
      "question": "Welches Verkehrsunternehmen betreibt die Informationsstelle?",
      "input": {
         "type": "String",
         "values": {
            "single": {
               "name": "Betreiber",
               "osm_tags": {
                  "operator": "%s"
               }
            }
         }
      },
      "conditions": [
         {
            "osm_tags": {
               "tourism": "information",
               "information": "office",
               "information:public_transport": "yes",
               "operator": false
            }
         }
      ]
   },
   {
      "id": 1032,
      "name": "Rollstuhlgerecht",
      "question": "Ist die Informationsstelle rollstuhlgerecht?",
      "description": "Rollstuhlgerecht bedeutet, die Informationsstelle ist stufenfrei erreichbar und die Zugänge haben eine ausreichende Breite (≥90cm).",
      "input": {
         "type": "Bool",
         "values": {
            "true": {
               "osm_tags": {
                  "wheelchair": "yes"
               }
            },
            "false": {
               "osm_tags": {
                  "wheelchair": "no"
               }
            }
         }
      },
      "conditions": [
         {
            "osm_tags": {
               "tourism": "information",
               "information": "office",
               "information:public_transport": "yes",
               "wheelchair": false
            }
         }
      ]
   },
   {
      "id": 1051,
      "name": "Parkplatzart",
      "question": "Um welche Parkplatzart handelt es sich?",
      "input": {
         "type": "List",
         "values": {
            "surface": {
               "name": "Ebenerdiger Parkplatz",
               "image": "packages/nvbw_open_data/photos/1051a.jpg",
               "osm_tags": {
                  "parking": "surface"
               }
            },
            "underground": {
               "name": "Tiefgarage",
               "image": "packages/nvbw_open_data/photos/1051b.jpg",
               "osm_tags": {
                  "parking": "underground"
               }
            },
            "street_side": {
               "name": "Parkbucht",
               "image": "packages/nvbw_open_data/photos/1051c.jpg",
               "osm_tags": {
                  "parking": "street_side"
               }
            },
            "multi-storey": {
               "name": "Parkhaus",
               "image": "packages/nvbw_open_data/photos/1051d.jpg",
               "osm_tags": {
                  "parking": "multi-storey"
               }
            }
         }
      },
      "conditions": [
         {
            "osm_tags": {
               "amenity": "parking",
               "access": [
                  "yes",
                  "customers",
                  false
               ],
               "parking": false
            }
         }
      ]
   },
   {
      "id": 1051,
      "name": "Behindertenparkplätze",
      "question": "Gibt es gesonderte Parkplätze für behinderte Personen?",
      "image": [
         "packages/nvbw_open_data/photos/1051e.jpg",
         "packages/nvbw_open_data/photos/1051f.jpg",
         "packages/nvbw_open_data/photos/1051g.jpg"
      ],
      "input": {
         "type": "Bool",
         "values": {
            "true": {
               "osm_tags": {
                  "capacity:disabled": "yes"
               }
            },
            "false": {
               "osm_tags": {
                  "capacity:disabled": "no"
               }
            }
         }
      },
      "conditions": [
         {
            "osm_tags": {
               "amenity": "parking",
               "access": [
                  "yes",
                  "customers",
                  false
               ],
               "capacity:disabled": false
            }
         }
      ]
   },
   {
      "id": 1051,
      "name": "Anzahl an Behindertenparkplätzen",
      "question": "Wie viele Parkplätze für behinderte Personen gibt es?",
      "description": "Behindertenparkplätze sind eigene Parkmöglichkeiten für behinderte Personen und weisen i.d.R. geräumigere Stellplatzmaße auf. Behindertenparkplätze sind durch ein Zusatzschild mit dem Piktogramm eines Rollstuhlfahrers gekennzeichnet. Zusätzlich sind meist Bodenmarkierungen angebracht.",
      "input": {
         "type": "Number",
         "values": {
            "single": {
               "name": "Parkplatzanzahl",
               "decimals": 0,
               "min": 1,
               "max": 1000,
               "osm_tags": {
                  "capacity:disabled": "%s"
               }
            }
         }
      },
      "conditions": [
         {
            "osm_tags": {
               "amenity": "parking",
               "access": [
                  "yes",
                  "customers",
                  false
               ],
               "capacity:disabled": "yes"
            }
         }
      ]
   },
   {
      "id": 1052,
      "name": "Park+Ride",
      "question": "Ist dies ein Park+Ride-Parkplatz?",
      "description": "Park+Ride-Anlagen sind Parkplätze mit Anbindung an öffentliche Verkehrsmittel, die es Personen ermöglichen, ihr Fahrzeug zu verlassen und für den Rest der Reise auf öffentliche Verkehrsmittel umzusteigen.",
      "image": [
         "packages/nvbw_open_data/photos/1052a.jpg",
         "packages/nvbw_open_data/photos/1052b.jpg",
         "packages/nvbw_open_data/photos/1052c.jpg"
      ],
      "input": {
         "type": "Bool",
         "values": {
            "true": {
               "osm_tags": {
                  "park_ride": "yes"
               }
            },
            "false": {
               "osm_tags": {
                  "park_ride": "no"
               }
            }
         }
      },
      "conditions": [
         {
            "osm_tags": {
               "amenity": "parking",
               "access": [
                  "yes",
                  "customers",
                  false
               ],
               "park_ride": false
            }
         }
      ]
   },
   {
      "id": 1052,
      "name": "Parkplatzgebühren",
      "question": "Fallen für das Parken Gebühren an?",
      "input": {
         "type": "Bool",
         "values": {
            "true": {
               "osm_tags": {
                  "fee": "yes"
               }
            },
            "false": {
               "osm_tags": {
                  "fee": "no"
               }
            }
         }
      },
      "conditions": [
         {
            "osm_tags": {
               "amenity": "parking",
               "access": [
                  "yes",
                  "customers",
                  false
               ],
               "fee": false
            }
         }
      ]
   },
   {
      "id": 1071,
      "name": "Toiletten-Zugänglichkeit",
      "question": "Für wen sind die Toiletten zugänglich?",
      "input": {
         "type": "List",
         "values": {
            "only": {
               "name": "Ausschließlich für Rollstuhlfahrende",
               "description": "Die Toiletten sind nur für Rollstuhlfahrende vorgesehen.",
               "osm_tags": {
                  "wheelchair": "designated"
               }
            },
            "yes": {
               "name": "Für Rollstuhlfahrende und andere",
               "description": "Die Toiletten sind für Rollstuhlfahrende und andere Personen vorgesehen.",
               "osm_tags": {
                  "wheelchair": "yes"
               }
            },
            "no": {
               "name": "Nicht für Rollstuhlfahrende",
               "description": "Die Toiletten sind nicht rollstuhlgerecht. Rollstuhlfahrernde haben keine Zugangsmöglichkeiten.",
               "osm_tags": {
                  "wheelchair": "no"
               }
            }
         }
      },
      "conditions": [
         {
            "osm_tags": {
               "amenity": "toilets",
               "access": [
                  "yes",
                  false
               ],
               "wheelchair": false
            }
         }
      ]
   },
   {
      "id": 1073,
      "name": "Toiletten nur mit Schlüssel zugänglich",